1357;Funeral for a Friend/Love Lies Bleeding;"Funeral for a Friend/Love Lies Bleeding  una suite progressive composta ed interpretata dall artista britannico Elton John; il testo di Love Lies Bleeding  di Bernie Taupin.";https://www.youtube.com/v/3p_xAToFzck?version=3&f=videos&d=AYcmKYILM6rpFUn86Vnl8m4O88HsQjpE1a8d1GxQnGDm&app=youtube_gdata;1970;1973
1358;One of My Turns;One Of My Turns  una canzone dei Pink Floyd pubblicata nel 1979 all interno dell album The Wall. Fu inclusa nella parte b del singolo Another Brick in the Wall (Parte 2).;https://www.youtube.com/v/7sMVXa3Xw68?version=3&f=videos&d=AYcmKYILM6rpFUn86Vnl8m4O88HsQjpE1a8d1GxQnGDm&app=youtube_gdata;1970;1979
1359;Surf s Up (brano musicale);Surf s Up  un brano musicale dei Beach Boys composto da Brian Wilson per la musica e da Van Dyke Parks per il testo. La canzone era stata concepita per essere inserita nell abortito album SMiLE, iniziato nel 1966 ma lasciato incompiuto nel 1967. In segu;https://www.youtube.com/v/0Ic8pi-Xzak?version=3&f=videos&d=AYcmKYILM6rpFUn86Vnl8m4O88HsQjpE1a8d1GxQnGDm&app=youtube_gdata;2010;2011
1360;The Passenger;The Passenger  una canzone scritta da Iggy Pop e dal chitarrista Ricky Gardiner, interpretata dallo stesso Iggy Pop e pubblicata nell album Lust for Life nel 1977. Possiede un riff di chitarra molto distintivo, ma  probabilmente pi popolare il ritorne;https://www.youtube.com/v/hLhN__oEHaw?version=3&f=videos&d=AYcmKYILM6rpFUn86Vnl8m4O88HsQjpE1a8d1GxQnGDm&app=youtube_gdata;1980;1987
1361;Siberian Khatru;Siberian Khatru  una canzone della progressive rock band inglese Yes, tratta dall album Close to the Edge, edito nel 1972 dalla Atlantic Records. Versioni dal vivo del brano sono presenti negli album Yessongs, Keys to Ascension, e Live at Montreux 2003,;https://www.youtube.com/v/r0HnIr6jYWU?version=3&f=videos&d=AYcmKYILM6rpFUn86Vnl8m4O88HsQjpE1a8d1GxQnGDm&app=youtube_gdata;1970;1972
1362;Maybe I m Amazed;Maybe I m Amazed  una canzone di Paul McCartney pubblicata il 17 aprile 1970 nell album McCartney. La canzone  dedicata alla moglie di McCarteny, Linda, che lo aveva sostenuto durante la separazione dei Beatles. Nel 1976, gli Wings, il nuovo gruppo di ;https://www.youtube.com/v/cm2YyVZBL8U?version=3&f=videos&d=AYcmKYILM6rpFUn86Vnl8m4O88HsQjpE1a8d1GxQnGDm&app=youtube_gdata;1970;1970
1363;Don t Leave Me Now (brano musicale);Don t Leave Me Now  una canzone dei Pink Floyd edita nel 1979 all interno dell album The Wall.;https://www.youtube.com/v/7p68yeHWWxI?version=3&f=videos&d=AYcmKYILM6rpFUn86Vnl8m4O88HsQjpE1a8d1GxQnGDm&app=youtube_gdata;1970;1979
1364;Life s What You Make It (Hannah Montana);"Life s What You Make It  un singolo di Hannah Montana, ispirato alla seconda stagione della serie tv Hannah Montana. La canzone si pu trovare in diversi CD: ""Hannah Montana 2: Meet Miley Cyrus"", ""Hannah Montana 2: Rockstar Edition"", ""Hannah Montana & M";https://www.youtube.com/v/Pa8SEr5_2Zg?version=3&f=videos&d=AYcmKYILM6rpFUn86Vnl8m4O88HsQjpE1a8d1GxQnGDm&app=youtube_gdata;2000;2007
1365;Green Is the Colour;Green Is the Colour  una canzone della progressive rock band Pink Floyd, tratto dall album Soundtrack from the Film More del 1969.;https://www.youtube.com/v/dRZCzxI-akU?version=3&f=videos&d=AYcmKYILM6rpFUn86Vnl8m4O88HsQjpE1a8d1GxQnGDm&app=youtube_gdata;1960;1969
1366;Crickets Sing for Anamaria;Crickets Sing for Anamaria  il quarto e ultimo singolo estratto dal secondo album della cantautrice inglese Emma Bunton, Free Me, pubblicato dall etichetta Polydor. Si tratta di una cover di una canzone di Astrud Gilberto pubblicata nel 1965. Il singolo;https://www.youtube.com/v/YQ6kKlevpqs?version=3&f=videos&d=AYcmKYILM6rpFUn86Vnl8m4O88HsQjpE1a8d1GxQnGDm&app=youtube_gdata;1960;1968
1367;Vegemain_songs;Vegemain_songs (o Vega-main_songs)  un brano musicale composto da Brian Wilson e Van Dyke Parks per il gruppo musicale statunitense The Beach Boys. La canzone venne pubblicata sul loro album del 1967 intitolato Smiley Smile con Al Jardine e Brian Wilson alla vo;https://www.youtube.com/v/d0fk15GI7IA?version=3&f=videos&d=AYcmKYILM6rpFUn86Vnl8m4O88HsQjpE1a8d1GxQnGDm&app=youtube_gdata;2010;2011
1368;You Still Believe in Me;"You Still Believe in Me  il titolo di un brano musicale dei The Beach Boys, seconda traccia dell album Pet Sounds pubblicato nel 1966. Il testo della canzone, originariamente intitolata In My Childwood (""nella mia infanzia"") come nostalgica incursione n";https://www.youtube.com/v/VZbgAeR5wx0?version=3&f=videos&d=AYcmKYILM6rpFUn86Vnl8m4O88HsQjpE1a8d1GxQnGDm&app=youtube_gdata;1960;1966
1369;Good Morning Good Morning;Good Morning Good Morning  una canzone composta dal solo John Lennon (ma accreditata al duo compositivo Lennon/McCartney) e pubblicata dai Beatles sull album del 1967 Sgt. Pepper s Lonely Hearts Club Band.;https://www.youtube.com/v/Yu6--WBPBHo?version=3&f=videos&d=AYcmKYILM6rpFUn86Vnl8m4O88HsQjpE1a8d1GxQnGDm&app=youtube_gdata;1960;1967
1370;Two of Us;Two of Us  un brano musicale del 1970 del gruppo britannico The Beatles e contenuta nel loro ultimo album Let it Be ed anche nell album Let It Be... Naked e nella raccolta Anthology 3. La canzone  stata scritta da Paul McCartney (pur essendo attribuita;https://www.youtube.com/v/2Ztr8j_-gD4?version=3&f=videos&d=AYcmKYILM6rpFUn86Vnl8m4O88HsQjpE1a8d1GxQnGDm&app=youtube_gdata;1970;1970
1371;Wait (The Beatles);Wait  un brano musicale dei Beatles, accreditato alla coppia Lennon/McCartney, pubblicato nell album Rubber Soul. La canzone di solito  indicata come un lavoro fatto in coppia da Lennon e McCartney, anche se nel 1997 tramite il libro Many Years from No;https://www.youtube.com/v/6O5w5h2T87c?version=3&f=videos&d=AYcmKYILM6rpFUn86Vnl8m4O88HsQjpE1a8d1GxQnGDm&app=youtube_gdata;1960;1965
1372;Gabriel s Oboe;Gabriel s Oboe  un brano musicale scritto da Ennio Morricone per il film Mission, candidato all Oscar come miglior colonna sonora, del 1986. La sua caratteristica  la capacit di trasmettere, con pochi strumenti tra i quali in primo piano un oboe, un s;https://www.youtube.com/v/jmax47l2hLU?version=3&f=videos&d=AYcmKYILM6rpFUn86Vnl8m4O88HsQjpE1a8d1GxQnGDm&app=youtube_gdata;1980;1986
1373;I Wanna Go Crazy;I Wanna Go Crazy  un il secondo singolo promozionale, dopo Gettin  Over, di David Guetta, con la partecipazione di Will.I. Am, estratto dal quarto album in studio di Guetta, intitolato One Love. E  stato pubblicato in tutto il mondo il 24 agosto 2009. G;https://www.youtube.com/v/vigA7yWue58?version=3&f=videos&d=AYcmKYILM6rpFUn86Vnl8m4O88HsQjpE1a8d1GxQnGDm&app=youtube_gdata;2000;2009
1374;Georgia (brano musicale);"Georgia  un brano composto ed interpretato dall artista britannico Elton John; il testo  di Gary Osborne.";https://www.youtube.com/v/yf6G6jXCS4c?version=3&f=videos&d=AYcmKYILM6rpFUn86Vnl8m4O88HsQjpE1a8d1GxQnGDm&app=youtube_gdata;1970;1978
1375;The Narrow Way;"The Narrow Way  una suite musicale dei Pink Floyd, composta dal chitarrista del gruppo David Gilmour per l album Ummagumma. In realt, rispetto alle altre suite presenti sull album (""Sysyphus"" e ""The Grand Vizier s Garden Party""), la composizione di Gil";https://www.youtube.com/v/jVdPHLdPnS8?version=3&f=videos&d=AYcmKYILM6rpFUn86Vnl8m4O88HsQjpE1a8d1GxQnGDm&app=youtube_gdata;1960;1969
1376;Wah-Wah (brano musicale);Wah-Wah  una canzone scritta da George Harrison originariamente rilascita in All Things Must Pass, 1970. Venne scritta all inizio del 1969 durante le registrazioni dell album dei Beatles Let It Be, il brano riflette le frustrazioni di Harrison durante i;https://www.youtube.com/v/eUfSym5Pb5s?version=3&f=videos&d=AYcmKYILM6rpFUn86Vnl8m4O88HsQjpE1a8d1GxQnGDm&app=youtube_gdata;1970;1970
1377;Love Me (Justin Bieber);"Love Me  una canzone elettropop dell  artista canadese Justin Bieber. Il brano  stato rilasciato in esclusiva per iTunes come primo singolo digitale di debutto del cantante, il 26 ottobre 2009. La canzone prende spunto da ""Lovefool"" della band svedese ";https://www.youtube.com/v/qdDVtFvJwUc?version=3&f=videos&d=AYcmKYILM6rpFUn86Vnl8m4O88HsQjpE1a8d1GxQnGDm&app=youtube_gdata;2000;2009
1378;Hey You (Madonna);Hey You  una canzone della popstar Madonna. La canzone, scritta e prodotta da Madonna e Pharrell Williams per il Live Earth,  scaricabile solo dal web ed i proventi del download vanno tutti a favore dell iniziativa Live Earth. Il Live Earth  una manif;https://www.youtube.com/v/-I8v-HZ40og?version=3&f=videos&d=AYcmKYILM6rpFUn86Vnl8m4O88HsQjpE1a8d1GxQnGDm&app=youtube_gdata;2000;2007
1379;The Lady Is a Tramp;The Lady Is a Tramp  un brano musicale facente parte del musical del 1937 Babes in Arms di Rodgers and Hart, nel quale veniva interpretato dall ex attrice bambina Mitzi Green. La canzone prende in giro l alta societ di New York e la sua rigida etichett;https://www.youtube.com/v/ZPAmDULCVrU?version=3&f=videos&d=AYcmKYILM6rpFUn86Vnl8m4O88HsQjpE1a8d1GxQnGDm&app=youtube_gdata;2010;2011
1380;Foxy Lady (Jimi Hendrix);"Foxy Lady  una canzone del primo album di Jimi Hendrix del 1967 Are You Experienced; nell edizione americana appare a volte come Foxey Lady. La canzone  forse dedicata alla sua ragazza del tempo, Kathy Etchingham che ha detto pi volte di esser stata l";https://www.youtube.com/v/PnJ60dm1dJw?version=3&f=videos&d=AYcmKYILM6rpFUn86Vnl8m4O88HsQjpE1a8d1GxQnGDm&app=youtube_gdata;1960;1967
1381;Beyond the Sea (Bobby Darin);Beyond the Sea  il titolo della versione in lingua inglese della canzone La Mer composta nel 1943 dal fantasista francese Charles Trenet e da Lo Chauliac durante un viaggio in treno fra Narbonne e Carcassonne. Il brano fu poi inciso da Trenet e lanciat;https://www.youtube.com/v/m8OlDPqYBLw?version=3&f=videos&d=AYcmKYILM6rpFUn86Vnl8m4O88HsQjpE1a8d1GxQnGDm&app=youtube_gdata;1950;1959
1382;Six Degrees of Inner Turbulence (brano musicale);"Six Degrees of Inner Turbulence  la title track dell omonimo doppio cd del gruppo progressive metal Dream Theater. Tale brano  una suite di 42 minuti, che occupa interamente il secondo cd dell album. Il riferimento al numero ""sei""  accentuato dal fatt";PROBLEMA;2000;2002
1383;When the Tigers Broke Free;When the Tigers Broke Free (o talvolta When the Tygers Broke Free)  un singolo della progressive rock band inglese Pink Floyd, pubblicato per la prima volta nel 1982 all interno del film Pink Floyd The Wall, scritto da Roger Waters, e nella relativa col;https://www.youtube.com/v/TH2LoYnQeog?version=3&f=videos&d=AYcmKYILM6rpFUn86Vnl8m4O88HsQjpE1a8d1GxQnGDm&app=youtube_gdata;1980;1983
1384;Little Wing;Little Wing  il titolo di una canzone della rock band The Jimi Hendrix Experience, scritta dal chitarrista e leader del gruppo Jimi Hendrix e registrata sull album del 1967 Axis: Bold as Love. Il noto periodico musicale Rolling Stone Magazine l ha piazz;https://www.youtube.com/v/XLvND_uavLs?version=3&f=videos&d=AYcmKYILM6rpFUn86Vnl8m4O88HsQjpE1a8d1GxQnGDm&app=youtube_gdata;1960;1967
1385;Ne me quitte pas;Ne me quitte pas  una canzone di Jacques Brel scritta nel 1958 e pubblicata la prima volta l 11 settembre 1959 nell album La Valse  Mille  una delle canzoni pi note dell autore belga, reincisa pi volte da Brel e reinterpretata da numerosi aut;https://www.youtube.com/v/i2wmKcBm4Ik?version=3&f=videos&d=AYcmKYILM6rpFUn86Vnl8m4O88HsQjpE1a8d1GxQnGDm&app=youtube_gdata;1950;1959
1386;Crippled Inside;Crippled Inside  un brano musicale scritto ed interpretato da John Lennon. La canzone  inserita nell album Imagine ed  uscita nel 1971.;https://www.youtube.com/v/XBuMC25npYk?version=3&f=videos&d=AYcmKYILM6rpFUn86Vnl8m4O88HsQjpE1a8d1GxQnGDm&app=youtube_gdata;1970;1971
1387;Superman (Lazlo Bane);Superman  un brano composto dalla band americana Lazlo Bane e da Pondy Doorcan, facente parte dell album All the Time in the World del .;https://www.youtube.com/v/gQjFHxJ9IKs?version=3&f=videos&d=AYcmKYILM6rpFUn86Vnl8m4O88HsQjpE1a8d1GxQnGDm&app=youtube_gdata;2000;2002
1388;Red House;Red House  una canzone della versione inglese del primo album di Jimi Hendrix del 1967, Are You Experienced. In questa canzone si sentono le forti influenze blues di Jimi Hendrix. Nella versione americana del disco la traccia non compare, poich la casa;https://www.youtube.com/v/vnOyMSEWNTs?version=3&f=videos&d=AYcmKYILM6rpFUn86Vnl8m4O88HsQjpE1a8d1GxQnGDm&app=youtube_gdata;1960;1967
1389;53rd & 3rd;53rd & 3rd  il secondo singolo pubblicato dalla band punk americana Ramones ed incluso nell album Ramones del 1976.;https://www.youtube.com/v/3qcMjKxt-dE?version=3&f=videos&d=AYcmKYILM6rpFUn86Vnl8m4O88HsQjpE1a8d1GxQnGDm&app=youtube_gdata;1970;1976
1390;God (John Lennon);God  una canzone di John Lennon contenuta sul suo primo album da solista dopo lo scioglimento dei Beatles, John Lennon/Plastic Ono Band. Il disco fu pubblicato 11 dicembre del 1970 contemporaneante sia negli Stati Uniti che in Gran Bretagna. La canzon;https://www.youtube.com/v/3yUSGvm4BXA?version=3&f=videos&d=AYcmKYILM6rpFUn86Vnl8m4O88HsQjpE1a8d1GxQnGDm&app=youtube_gdata;1970;1970
1392;Bang a Drum;Bang a Drum  un brano musicale country-rock scritto da Jon Bon Jovi ed originariamente interpretato dal gruppo di cui fa parte, i Bon Jovi. Fu inserito nell album Blaze of Glory, ispirato dal film Young Guns II. Nel 1998 il cantante country Chris LeDoux;https://www.youtube.com/v/4i8b_LTSxgg?version=3&f=videos&d=AYcmKYILM6rpFUn86Vnl8m4O88HsQjpE1a8d1GxQnGDm&app=youtube_gdata;1990;1990
1393;What Do You Want from Me;"""What Do You Want from Me""  la seconda canzone dell album dei Pink Floyd del 1994 The Division  stata composta da Richard Wright, David Gilmour e Polly Samson. La parte introduttiva della canzone ricorda l inizio live di Embryo, brano eseguito ne";https://www.youtube.com/v/ZRhIAQAiTtY?version=3&f=videos&d=AYcmKYILM6rpFUn86Vnl8m4O88HsQjpE1a8d1GxQnGDm&app=youtube_gdata;1990;1994
1394;Get  Em Out by Friday;"Get  Em Out by Friday (""Buttali fuori entro venerd"")  una canzone rock epic inclusa nell album del 1972, Foxtrot, del gruppo rock progressivo dei Genesis, della durata di circa 8 minuti e mezzo. Il brano appare anche nel loro album live del 1973.";https://www.youtube.com/v/Kp-TwWnn0dk?version=3&f=videos&d=AYcmKYILM6rpFUn86Vnl8m4O88HsQjpE1a8d1GxQnGDm&app=youtube_gdata;1970;1972
1395;Love (John Lennon);Love  una ballata di John Lennon, pubblicata in origine nell album John Lennon/Plastic Ono Band del 1970, e fatta uscire come singolo nel 1982.;https://www.youtube.com/v/2GmVajkqLNU?version=3&f=videos&d=AYcmKYILM6rpFUn86Vnl8m4O88HsQjpE1a8d1GxQnGDm&app=youtube_gdata;1970;1970
1396;Mona Lisas and Mad Hatters;"Mona Lisas And Mad Hatters  un brano scritto ed interpretato da Elton John; il testo  di Bernie Taupin.";https://www.youtube.com/v/9tRgYfQ48A0?version=3&f=videos&d=AYcmKYILM6rpFUn86Vnl8m4O88HsQjpE1a8d1GxQnGDm&app=youtube_gdata;1970;1972
1397;I Will;I Will  un brano musicale dei Beatles contenuto nell album The Beatles (meglio noto come White Album o Album Bianco).;https://www.youtube.com/v/O8muJIOznsg?version=3&f=videos&d=AYcmKYILM6rpFUn86Vnl8m4O88HsQjpE1a8d1GxQnGDm&app=youtube_gdata;1960;1968
1398;War Pigs;War Pigs (inizialmente intitolata Walpurgis)  uno dei pi celebri brani del gruppo heavy metal Black Sabbath, lunga 7 minuti e 52 secondi. Appartiene all album Paranoid, disco del 1970, il pi famoso di tutta la loro carriera. Il testo della canzone pre;https://www.youtube.com/v/pZCyOWLrRTE?version=3&f=videos&d=AYcmKYILM6rpFUn86Vnl8m4O88HsQjpE1a8d1GxQnGDm&app=youtube_gdata;1970;1970
1399;Blackbird (The Beatles);Blackbird  un brano dei Beatles, contenuto nell album The Beatles (meglio noto come White Album o Album Bianco).;https://www.youtube.com/v/7epRPz0LGPE?version=3&f=videos&d=AYcmKYILM6rpFUn86Vnl8m4O88HsQjpE1a8d1GxQnGDm&app=youtube_gdata;1960;1968
1400;Whatever U Like;"Whatever U Like  il titolo del primo singolo estratto dall album di debutto di Nicole Scherzinger, ""Her Name Is Nicole"", pubblicato nel 2008. Il singolo  stato prodotto con la collaborazione del rapper T.I. ed  stato pubblicato nel luglio del 2007 neg";https://www.youtube.com/v/nQJACVmankY?version=3&f=videos&d=AYcmKYILM6rpFUn86Vnl8m4O88HsQjpE1a8d1GxQnGDm&app=youtube_gdata;2000;2007
1401;Marvins Room;Marvins Room  una brano musicale del cantante canadese Drake, estratto il 22 luglio 2011 come singolo promozionale dal suo secondo album, intitolato Take Care. Il pezzo  stato scritto da Aubrey Graham (lo stesso Drake), Noah Shebib, Adrian Eccleston e ;https://www.youtube.com/v/nwyjxsOYnys?version=3&f=videos&d=AYcmKYILM6rpFUn86Vnl8m4O88HsQjpE1a8d1GxQnGDm&app=youtube_gdata;2010;2011
1402;Guaranteed (Eddie Vedder);Guaranteed  una canzone di Eddie Vedder inclusa nella colonna sonora del film Into the Wild - Nelle terre selvagge. Come per le altre canzoni della colonna sonora, Vedder nello scrivere il testo si  ispirato alla vera storia di Christopher McCandless. ;https://www.youtube.com/v/qeI_D1CD_7c?version=3&f=videos&d=AYcmKYILM6rpFUn86Vnl8m4O88HsQjpE1a8d1GxQnGDm&app=youtube_gdata;2000;2007
1403;The Elements: Fire;"The Elements: Fire, conosciuto anche con i titoli The Elements, Fire, e Mrs. O Leary s Cow,  un brano strumentale composto dal musicista statunitense Brian Wilson. La traccia doveva originariamente essere inclusa nel celebre ""album perduto"" dei Beach Bo";https://www.youtube.com/v/31pCY1uDRzY?version=3&f=videos&d=AYcmKYILM6rpFUn86Vnl8m4O88HsQjpE1a8d1GxQnGDm&app=youtube_gdata;2010;2011
1404;Here Comes the Sun;Here Comes the Sun  una canzone dei Beatles del 1969, contenuta nell album Abbey Road e composta da George Harrison.;https://www.youtube.com/v/yGKPHFrHVVY?version=3&f=videos&d=AYcmKYILM6rpFUn86Vnl8m4O88HsQjpE1a8d1GxQnGDm&app=youtube_gdata;1960;1969
1405;Spanish Castle Magic;Spanish Castle Magic  una canzone del secondo album di Jimi Hendrix del 1967 Axis: Bold as Love. La canzone parla di un viaggio immaginario attraverso un drago volante dove ci sono fantastiche visioni (ad es. nuvole inondate di zucchero filato) tutto qu;https://www.youtube.com/v/fy4kSpqNka8?version=3&f=videos&d=AYcmKYILM6rpFUn86Vnl8m4O88HsQjpE1a8d1GxQnGDm&app=youtube_gdata;1960;1967
1406;For No One;For No One  una canzone dei Beatles scritta da Paul McCartney (ma accreditata come da consuetudine al duo Lennon/McCartney) e contenuta nel settimo album della band, Revolver. Si tratta di un delicato brano di pop barocco che racconta la fine di una rel;https://www.youtube.com/v/J6iAykoKLog?version=3&f=videos&d=AYcmKYILM6rpFUn86Vnl8m4O88HsQjpE1a8d1GxQnGDm&app=youtube_gdata;1960;1966
1409;Cry Baby Cry (Beatles);Cry Baby Cry  una canzone dei Beatles contenuta nell album The Beatles (meglio noto come White Album o Album Bianco).;PROBLEMA;1960;1968
1410;Alan s Psychedelic Breakfast;Alan s Psychedelic Breakfast  il brano conclusivo dell album Atom Heart Mother dei Pink  stato concepito da tutt e quattro i componenti del gruppo.;https://www.youtube.com/v/YF1K1rQ8QNA?version=3&f=videos&d=AYcmKYILM6rpFUn86Vnl8m4O88HsQjpE1a8d1GxQnGDm&app=youtube_gdata;1970;1970
1411;1983... (A Merman I Should Turn to Be);1983... (A Merman I Should Turn to Be)  una canzone della band rock The Jimi Hendrix Experience inserita nel loro terzo album Electric Ladyland.;https://www.youtube.com/v/vyzmk0qio5E?version=3&f=videos&d=AYcmKYILM6rpFUn86Vnl8m4O88HsQjpE1a8d1GxQnGDm&app=youtube_gdata;1960;1968
1412;Nowhere Man (singolo);Nowhere Man  un brano musicale del gruppo britannico The Beatles, pubblicato dall etichetta discografica Parlophone il 15 febbraio 1966 come singolo appartenente all album Rubber Soul dell anno prima. Il lato B del 45 giri contiene il brano What Goes On.;https://www.youtube.com/v/UyiGRY8zMOg?version=3&f=videos&d=AYcmKYILM6rpFUn86Vnl8m4O88HsQjpE1a8d1GxQnGDm&app=youtube_gdata;1960;1965
1413;Return to Paradise;"Return to Paradise  un brano composto ed interpretato dall artista britannico Elton John; il testo  di Gary Osborne.";https://www.youtube.com/v/oUjpjZnA4Pw?version=3&f=videos&d=AYcmKYILM6rpFUn86Vnl8m4O88HsQjpE1a8d1GxQnGDm&app=youtube_gdata;1970;1978
1414;Good Night;Good Night  un brano musicale dei Beatles, la canzone finale che chiude l album The Beatles (meglio noto come White Album o Album Bianco).;https://www.youtube.com/v/uNSBq6hvU1s?version=3&f=videos&d=AYcmKYILM6rpFUn86Vnl8m4O88HsQjpE1a8d1GxQnGDm&app=youtube_gdata;1960;1968
1415;Dancing Through Life;"""Dancing Through Life"" (Danzando nella vita)  una canzone del musical Wicked di Stephen Schwartz. Fu interpretata originariamente a Broadway da Norbert Leo Butz nel ruolo di Fiyero, Kristin Chenoweth, Idina Menzel, Carole Shelley, Michelle Federer (Ness";https://www.youtube.com/v/of03sHr0O5I?version=3&f=videos&d=AYcmKYILM6rpFUn86Vnl8m4O88HsQjpE1a8d1GxQnGDm&app=youtube_gdata;2000;2003
1416;Play the Guitar;Play the Guitar  un brano musicale del cantante statunitense hip hop B.o. B, registrato in in collaborazione con il rapper Andr 3000 e prodotto da Salaam Remi. Il brano, estratto come singolo dall album Strange Clouds il 27 dicembre 2011 utilizza un ca;https://www.youtube.com/v/7zdnJEaRz_s?version=3&f=videos&d=AYcmKYILM6rpFUn86Vnl8m4O88HsQjpE1a8d1GxQnGDm&app=youtube_gdata;2010;2011
1417;Spanish Bombs;Spanish Bombs  una delle canzoni della band inglese The Clash, contenuta nell album del 1979 London Calling. La canzone appare anche nelle raccolte The Story of the Clash, Volume 1 e Clash on Broadway.;https://www.youtube.com/v/ertt3o1x65c?version=3&f=videos&d=AYcmKYILM6rpFUn86Vnl8m4O88HsQjpE1a8d1GxQnGDm&app=youtube_gdata;1970;1979
1418;Night of the Hunter;Night of the Hunter  un singolo promozionale dei 30 Seconds to Mars pubblicato nell aprile 2011, estratto dal terzo album della band This Is War.;https://www.youtube.com/v/0aSLS2GhyXA?version=3&f=videos&d=AYcmKYILM6rpFUn86Vnl8m4O88HsQjpE1a8d1GxQnGDm&app=youtube_gdata;2000;2009
1419;Got to Get You into My Life;Got to Get You into My Life  un brano musicale dei Beatles scritto da Paul McCartney (ma accreditato come da consuetudine al duo Lennon/McCartney) e contenuto nel settimo album della band, Revolver.;https://www.youtube.com/v/bxhhFOnXs2M?version=3&f=videos&d=AYcmKYILM6rpFUn86Vnl8m4O88HsQjpE1a8d1GxQnGDm&app=youtube_gdata;1960;1966
1420;Running to Stand Still;Running to Stand Still  la quinta canzone dell album The Joshua Tree del gruppo rock U2.;https://www.youtube.com/v/w_GQSH0IClc?version=3&f=videos&d=AYcmKYILM6rpFUn86Vnl8m4O88HsQjpE1a8d1GxQnGDm&app=youtube_gdata;1980;1987
1421;Poles Apart;Poles Apart  un brano musicale dei Pink Floyd, terza traccia dell album The Division Bell, l ultimo in studio per la rock band inglese. Il brano  stato composto dal chitarrista del gruppo David Gilmour, che si  avvalso della collaborazione di sua mogl;https://www.youtube.com/v/sVWxFDMCC3Y?version=3&f=videos&d=AYcmKYILM6rpFUn86Vnl8m4O88HsQjpE1a8d1GxQnGDm&app=youtube_gdata;1990;1994
1422;I Saw Her Standing There;I Saw Her Standing There  una canzone scritta da John Lennon e Paul McCartney ed  il brano di apertura dell album di debutto dei Beatles, Please Please Me del 1963. Il 26 dicembre 1963, negli Stati Uniti la Capitol Records ha pubblicato I Saw Her Stand;https://www.youtube.com/v/DsgWfAilIEM?version=3&f=videos&d=AYcmKYILM6rpFUn86Vnl8m4O88HsQjpE1a8d1GxQnGDm&app=youtube_gdata;1960;1963
1423;Dig It (brano musicale);Dig It  un brano dei Beatles, pubblicato sul loro ultimo album in studio, Let It  uno dei pochi brani accreditati a tutti i componenti del gruppo (gli altri sono Flying, Suzy Parker, 12-bar Original, Los Paranoias e la versione dei Beatles di Free ;https://www.youtube.com/v/7KlYM5_WLr0?version=3&f=videos&d=AYcmKYILM6rpFUn86Vnl8m4O88HsQjpE1a8d1GxQnGDm&app=youtube_gdata;1970;1970
1424;Nobody Home;"Nobody Home  una canzone dei Pink Floyd contenuta nell album The Wall, pubblicato nel 1979. Gran parte della canzone descrive lo stato mentale di Syd Barrett nel 1967 e, nell intervista ""Behind The Wall"", David Gilmour ha detto che il brano descrive ci";https://www.youtube.com/v/NGFSNE18Ywc?version=3&f=videos&d=AYcmKYILM6rpFUn86Vnl8m4O88HsQjpE1a8d1GxQnGDm&app=youtube_gdata;1970;1979
1425;A Day in the Life;"A Day in the Life (""Un giorno nella vita"")  l ultimo brano del disco Sgt. Pepper s Lonely Hearts Club  stato scritto da Paul McCartney e John Lennon.";https://www.youtube.com/v/P-Q9D4dcYng?version=3&f=videos&d=AYcmKYILM6rpFUn86Vnl8m4O88HsQjpE1a8d1GxQnGDm&app=youtube_gdata;1960;1967
1426;Octopus s Garden;"Octopus s Garden  un brano musicale dei Beatles, composto da Ringo Starr, pubblicato nell album Abbey Road (album). George Harrison lavor sulla canzone con Starr; forse perch le proprie canzoni venivano spesso respinte da John Lennon e Paul McCartney.";https://www.youtube.com/v/cgPqmRNjoTE?version=3&f=videos&d=AYcmKYILM6rpFUn86Vnl8m4O88HsQjpE1a8d1GxQnGDm&app=youtube_gdata;1960;1969
1427;Dear Prudence;Dear Prudence  una canzone di John Lennon e Paul McCartney del 1968, originariamente pubblicata come seconda traccia dell album The Beatles, anche noto come White Album.;https://www.youtube.com/v/7ppmdvXsMBE?version=3&f=videos&d=AYcmKYILM6rpFUn86Vnl8m4O88HsQjpE1a8d1GxQnGDm&app=youtube_gdata;1960;1968
1428;Gypsy (Of a Strange and Distant Time);Gypsy  una canzone del 1969 dei The Moody Blues, presente nell album To Our Children s Children s Children, composta dal chitarrista del gruppo Justin Hayward.;https://www.youtube.com/v/y99cd4BIL6Q?version=3&f=videos&d=AYcmKYILM6rpFUn86Vnl8m4O88HsQjpE1a8d1GxQnGDm&app=youtube_gdata;1960;1969
1429;Supper s Ready;s ready Supper un brano tratto dall album Foxtrot dei Genesis pubblicato nel 1972. Si tratta di una suite divisa in sette frammenti ed  uno dei brani pi interessanti del progressive rock e della musica degli anni settanta. Firmata da tutti i componen;https://www.youtube.com/v/-kORf_0uVTw?version=3&f=videos&d=AYcmKYILM6rpFUn86Vnl8m4O88HsQjpE1a8d1GxQnGDm&app=youtube_gdata;1970;1972
1430;If I Needed Someone;If I Needed Someone  un brano musicale dei Beatles, composto da George Harrison, pubblicato nell album Rubber Soul.;https://www.youtube.com/v/lCNqHIKJ4wk?version=3&f=videos&d=AYcmKYILM6rpFUn86Vnl8m4O88HsQjpE1a8d1GxQnGDm&app=youtube_gdata;1960;1965
