1284;All My Love;All my love  il titolo di una canzone scritta nel 1979 a firma Jones/Plant per ricordare Karac, il figlio di Plant, morto a 5 anni d infezione gastrica nel 1977. Pur non essendo il fatto mai stato confermato, la canzone  stata dedicata alla memoria del;https://www.youtube.com/v/qBI_Av00_Fo?version=3&f=videos&d=AYcmKYILM6rpFUn86Vnl8m4O88HsQjpE1a8d1GxQnGDm&app=youtube_gdata;1970;1979
1285;Pigs on the Wing;Pigs on the Wing  un brano musicale in due parti della progressive rock band inglese Pink Floyd. Il brano, scritto interamente da Roger Waters,  stato pubblicato per la prima volta nel concept album Animals del  inoltre presente nell album live ;https://www.youtube.com/v/SRJuXcYiOiU?version=3&f=videos&d=AYcmKYILM6rpFUn86Vnl8m4O88HsQjpE1a8d1GxQnGDm&app=youtube_gdata;1970;1977
1286;Magical Mystery Tour (brano musicale);"Magical Mystery Tour (""la magica gita a sorpresa"")  una canzone dei Beatles che d il titolo sia all album del gruppo che al film del 1967 ideato ed interpretato da loro stessi.";https://www.youtube.com/v/yByeWwurEnY?version=3&f=videos&d=AYcmKYILM6rpFUn86Vnl8m4O88HsQjpE1a8d1GxQnGDm&app=youtube_gdata;1960;1967
1287;Raining Blood;Raining Blood  un famoso brano della thrash metal band Slayer, che ha dato un grandissimo contributo per la nascita del metal estremo.;https://www.youtube.com/v/z8ZqFlw6hYg?version=3&f=videos&d=AYcmKYILM6rpFUn86Vnl8m4O88HsQjpE1a8d1GxQnGDm&app=youtube_gdata;1980;1986
1288;My Back Pages;My Back Pages  il titolo di una delle canzoni pi conosciute di Bob Dylan. Incisa nel 1964, fa parte dell album Another Side of Bob Dylan. Raramente Dylan l ha cantata durante i suoi concerti;https://www.youtube.com/v/S4UcaLHaabY?version=3&f=videos&d=AYcmKYILM6rpFUn86Vnl8m4O88HsQjpE1a8d1GxQnGDm&app=youtube_gdata;1960;1964
1289;I ve Been Loving You Too Long;"I ve Been Loving You Too Long (spesso chiamata anche I ve Been Loving You Too Long  una canzone scritta da Otis Redding e Jerry Butler. Il brano fu pubblicato come ""lato A"" di un singolo del 1965 di Otis Redding, ed in seguito fu inserita nel suo terzo ";https://www.youtube.com/v/qZ6OrrkeVFo?version=3&f=videos&d=AYcmKYILM6rpFUn86Vnl8m4O88HsQjpE1a8d1GxQnGDm&app=youtube_gdata;1960;1965
1290;Oceania (Bjrk);Oceania  una canzone della cantante islandese Bjrk ed  estratta dall album  stata scritta appositamente per la cerimonia di apertura della XXVIII Olimpiade ad Atene. Come tutte le canzoni contenute nell album, la canzone  composta solo dal ;https://www.youtube.com/v/Qv5ZU06JDN4?version=3&f=videos&d=AYcmKYILM6rpFUn86Vnl8m4O88HsQjpE1a8d1GxQnGDm&app=youtube_gdata;2000;2004
1291;Awaken;Awaken  un brano della progressive rock band inglese Yes pubblicato sull album Going for the One del 1977.;https://www.youtube.com/v/uCUnhoe0rpU?version=3&f=videos&d=AYcmKYILM6rpFUn86Vnl8m4O88HsQjpE1a8d1GxQnGDm&app=youtube_gdata;1970;1977
1292;Glamorous Indie Rock & Roll;Glamorous Indie Rock & Roll  una canzone composta dai The  presente nell album di debutto del gruppo Hot Fuss.;https://www.youtube.com/v/ELB-J6q-Whk?version=3&f=videos&d=AYcmKYILM6rpFUn86Vnl8m4O88HsQjpE1a8d1GxQnGDm&app=youtube_gdata;2000;2005
1293;She Said She Said;"She Said She Said  un brano musicale dei Beatles contenuto nell album Revolver del 1966. John Lennon, che ne  il principale autore, descrisse il brano come ""una canzone acida"" dal testo ispirato ai commenti fatti dall attore Peter Fonda durante un fest";https://www.youtube.com/v/6wp91YPGnLw?version=3&f=videos&d=AYcmKYILM6rpFUn86Vnl8m4O88HsQjpE1a8d1GxQnGDm&app=youtube_gdata;1960;1966
1294;Absolutely Sweet Marie;Absolutely Sweet Marie  una canzone di Bob Dylan, contenuta nel suo doppio album del 1966 Blonde on Blonde. Brano dal ritmo esuberante, il testo di Sweet Marie  pieno di svariate, spesso difficili da scovare, metafore sessuali.;https://www.youtube.com/v/p-cF40OWeak?version=3&f=videos&d=AYcmKYILM6rpFUn86Vnl8m4O88HsQjpE1a8d1GxQnGDm&app=youtube_gdata;1960;1966
1295;Getting Better;Getting Better  il titolo di una canzone composta e registrata dai Beatles nel 1967, e fa parte del loro ottavo album, Sgt. Pepper s Lonely Hearts Club Band.;https://www.youtube.com/v/Jk0dBZ1meio?version=3&f=videos&d=AYcmKYILM6rpFUn86Vnl8m4O88HsQjpE1a8d1GxQnGDm&app=youtube_gdata;1960;1967
1296;Sleazy;Sleazy  un brano musicale della cantante statunitense Kesha, estratto come primo singolo promozionale dal suo EP Cannibal. Sleazy  stata scritta da Kesha Sebert, Lukasz Gottwald, Benjamin Levin, Shondrae Crawford e Klas hlund e prodotta da Bangladesh,;https://www.youtube.com/v/n2kdCJRAiNk?version=3&f=videos&d=AYcmKYILM6rpFUn86Vnl8m4O88HsQjpE1a8d1GxQnGDm&app=youtube_gdata;2010;2010
1297;Dazed and Confused (brano musicale);Dazed and Confused  un brano dell artista folk Jake Holmes, meglio conosciuto nella versione del gruppo inglese Led Zeppelin contenuto nel loro primo album, Led Zeppelin.;https://www.youtube.com/v/7DLKx-RKMy4?version=3&f=videos&d=AYcmKYILM6rpFUn86Vnl8m4O88HsQjpE1a8d1GxQnGDm&app=youtube_gdata;1960;1967
1298;Happiness Is a Warm Gun;Happiness Is a Warm Gun  un brano musicale dei Beatles presente sull album The Beatles (noto anche come White Album o Album Bianco).;https://www.youtube.com/v/qE2Vdcv9Q_o?version=3&f=videos&d=AYcmKYILM6rpFUn86Vnl8m4O88HsQjpE1a8d1GxQnGDm&app=youtube_gdata;1960;1968
1299;Wearing the Inside Out;Wearing the Inside Out  una canzone dei Pink Floyd del 1994, presente nell album The Division  la prima canzone del gruppo da Time in cui Richard Wright  il cantante solista, e l ultima in cui  il solista su un album dei PInk Floyd. Questa canz;https://www.youtube.com/v/7AJC287ynwY?version=3&f=videos&d=AYcmKYILM6rpFUn86Vnl8m4O88HsQjpE1a8d1GxQnGDm&app=youtube_gdata;1990;1994
1300;Julia (The Beatles);Julia  un brano dei Beatles contenuto nell album The Beatles (meglio noto come White Album o Album Bianco). Non solo fu scritta esclusivamente da John Lennon, ma  anche l unico brano nella storia dei Beatles completamente realizzato solo da lui. In que;https://www.youtube.com/v/ZcWzlxECaPo?version=3&f=videos&d=AYcmKYILM6rpFUn86Vnl8m4O88HsQjpE1a8d1GxQnGDm&app=youtube_gdata;1960;1968
1301;Little Bird (The Beach Boys);Little Bird  un brano musicale scritto da Dennis Wilson, Steve Kalinich, e Brian Wilson (non accreditato) per il gruppo musicale statunitense The Beach Boys. La canzone venne inclusa nel loro album del 1968 Friends, e pubblicata anche su singolo come B-;https://www.youtube.com/v/czrHo1MoLk4?version=3&f=videos&d=AYcmKYILM6rpFUn86Vnl8m4O88HsQjpE1a8d1GxQnGDm&app=youtube_gdata;1960;1968
1302;Rearviewmirror (brano musicale);Rearviewmirror  il titolo della traccia 8 del secondo disco dei Pearl Jam, Vs.. Sebbene questa non fu mai rilasciata come singolo, la canzone risulta molto apprezzata dai fan (simile al caso di Yellow Ledbetter, b-side di Jeremy, che  divenuta una dell;https://www.youtube.com/v/2X1IfePfiuQ?version=3&f=videos&d=AYcmKYILM6rpFUn86Vnl8m4O88HsQjpE1a8d1GxQnGDm&app=youtube_gdata;1990;1993
1303;I Turn to You (Christina Aguilera);I Turn to You  una canzone pop/R&B scritta da Diane Warren nel 1996. La versione originale del brano  stato registrato dal quartetto All-4-one per la colonna sonora dell album del film della Warner Bros, Space Jam. Tre anni pi tardi, la cantante pop s;https://www.youtube.com/v/z4q05resEvc?version=3&f=videos&d=AYcmKYILM6rpFUn86Vnl8m4O88HsQjpE1a8d1GxQnGDm&app=youtube_gdata;2000;2000
1304;Marooned;Marooned  un brano musicale della progressive rock band inglese Pink Floyd, contenuto nell album The Division Bell e scritto da David Gilmour e Rick Wright. Il brano  stato premiato nel 1995 con un Grammy Award come miglior brano strumentale.;https://www.youtube.com/v/5OMFiqNA6Ag?version=3&f=videos&d=AYcmKYILM6rpFUn86Vnl8m4O88HsQjpE1a8d1GxQnGDm&app=youtube_gdata;1990;1994
1305;Roman s Revenge;Roman s Revenge  un brano musicale della cantante statunitense Nicki Minaj, estratto come singolo promozionale dal suo album di debutto, Pink Friday. Il brano  un duetto con il rapper Eminem ed  stato scritto da Kaseem Dean, Marshall Mathers, T. Smith;https://www.youtube.com/v/K9h_I90M8-M?version=3&f=videos&d=AYcmKYILM6rpFUn86Vnl8m4O88HsQjpE1a8d1GxQnGDm&app=youtube_gdata;2010;2010
1306;Helter Skelter (brano musicale);Helter Skelter  un brano musicale dei Beatles. La canzone fu scritta principalmente da Paul McCartney (sebbene porti anche la firma di John Lennon, secondo la convenzione che i due autori rispettarono sempre). Il brano apparve nell album The Beatles del;https://www.youtube.com/v/aMfkVGCU_BA?version=3&f=videos&d=AYcmKYILM6rpFUn86Vnl8m4O88HsQjpE1a8d1GxQnGDm&app=youtube_gdata;1960;1968
1307;Stop (Pink Floyd);Stop  una canzone dei Pink Floyd, pubblicata nel 1979 all interno dell album The Wall e scritta interamente da Roger Waters. Dura 30 secondi ed , quindi, la canzone pi breve della band.;https://www.youtube.com/v/2Vqu2zOwYYI?version=3&f=videos&d=AYcmKYILM6rpFUn86Vnl8m4O88HsQjpE1a8d1GxQnGDm&app=youtube_gdata;1970;1979
1308;The End (The Beatles);The End  la penultima canzone del penultimo album dei Beatles, intitolato Abbey Road.;https://www.youtube.com/v/7a_8F6gflxQ?version=3&f=videos&d=AYcmKYILM6rpFUn86Vnl8m4O88HsQjpE1a8d1GxQnGDm&app=youtube_gdata;1960;1969
1309;The Lamb Lies Down on Broadway (brano musicale);The Lamb Lies Down On Broadway  la traccia d apertura dell omonimo album dei Genesis. La canzone porta la firma di tutto il gruppo, anche se  stata scritta da Tony Banks e Peter Gabriel.;https://www.youtube.com/v/R4KYhlf1iak?version=3&f=videos&d=AYcmKYILM6rpFUn86Vnl8m4O88HsQjpE1a8d1GxQnGDm&app=youtube_gdata;1970;1974
1310;Being for the Benefit of Mr. Kite!;Being for the Benefit of Mr. Kite!  una canzone contenuta nell album dei Beatles del 1967 intitolato Sgt. Pepper s Lonely Hearts Club Band. Anche se composta dal solo John Lennon, la composizione viene accreditata al duo Lennon/McCartney.;https://www.youtube.com/v/vCiG7xoEb2Y?version=3&f=videos&d=AYcmKYILM6rpFUn86Vnl8m4O88HsQjpE1a8d1GxQnGDm&app=youtube_gdata;1960;1967
1311;Breathe (Taylor Swift);Breathe  una canzone della cantante statunitense country pop Taylor Swift, pubblicata come singolo promozionale prima della pubblicazione del suo secondo album Fearless. Il singolo  stato pubblicato il 21 ottobre 2008 dall etichetta discografica Big Ma;https://www.youtube.com/v/4a9O_jm8YA4?version=3&f=videos&d=AYcmKYILM6rpFUn86Vnl8m4O88HsQjpE1a8d1GxQnGDm&app=youtube_gdata;2000;2008
1312;Golden Slumbers;Golden Slumbers  un brano musicale dei Beatles. La canzone inizia la progressione che porta alla fine dell album, ed  seguita da Carry That Weight. Le due canzoni sono state registrate insieme come un unico pezzo, ed entrambe sono state scritte da Paul;https://www.youtube.com/v/2qP4Ye15J0Y?version=3&f=videos&d=AYcmKYILM6rpFUn86Vnl8m4O88HsQjpE1a8d1GxQnGDm&app=youtube_gdata;1960;1969
1313;Chimes of Freedom (Bob Dylan);Chimes of Freedom  il titolo di una canzone di Bob Dylan, pubblicata nell album Another Side of Bob Dylan nel 1964. La sua cover  stata incisa da diversi artisti tra cui Joan Baez, The Byrds, Roger McGuinn, Martyn Joseph, The Axis of Justice, The West ;https://www.youtube.com/v/VytWWO5HCpU?version=3&f=videos&d=AYcmKYILM6rpFUn86Vnl8m4O88HsQjpE1a8d1GxQnGDm&app=youtube_gdata;1960;1964
1314;Black (Pearl Jam);Black  un brano musicale tratto da Ten, album di debutto dei Pearl Jam. La canzone  il soliloquio di un uomo dal cuore spezzato che ricorda la sua amata perduta. Black  uno dei brani pi noti del gruppo ed  un pezzo centrale ed emozionante dell album;https://www.youtube.com/v/JfhsRIDh1RQ?version=3&f=videos&d=AYcmKYILM6rpFUn86Vnl8m4O88HsQjpE1a8d1GxQnGDm&app=youtube_gdata;1990;1991
1315;The Rain Song;The Rain Song  la seconda traccia del quinto album dei Led Zeppelin Houses of the Holy, uscito per l Atlantic Records nel 1973. Nonostante non sia una canzone nello stile Led Zeppelin, cio lenta e non molto potente,  stata una delle canzoni pi amate ;https://www.youtube.com/v/S4v-_p5dU34?version=3&f=videos&d=AYcmKYILM6rpFUn86Vnl8m4O88HsQjpE1a8d1GxQnGDm&app=youtube_gdata;1970;1973
1316;Isis (brano musicale);Isis  la seconda traccia dell album Desire di Bob Dylan. Racconta di un uomo che sposa la sua ragazza e poi se ne va di casa. Iside  la dea egiziana della medicina, della luna e del matrimonio (quando Dylan introduceva questa canzone durante la Rolling;https://www.youtube.com/v/RwCx3iHfClk?version=3&f=videos&d=AYcmKYILM6rpFUn86Vnl8m4O88HsQjpE1a8d1GxQnGDm&app=youtube_gdata;1970;1976
1317;Let s Go Away for Awhile;"Let s Go Away for Awhile (""Andiamocene via per un po "")  una traccia strumentale presente sull album Pet Sounds del gruppo musicale statunitense The Beach Boys, pubblicato dalla Capitol Records nel maggio  la sesta traccia dell album. Sempre nel ";https://www.youtube.com/v/RwGkv7cuM1k?version=3&f=videos&d=AYcmKYILM6rpFUn86Vnl8m4O88HsQjpE1a8d1GxQnGDm&app=youtube_gdata;1960;1966
1318;Lying from You;Lying from You  un brano del gruppo musicale statunitense Linkin Park, quarta traccia del secondo album studio Meteora, pubblicato il 25 marzo 2003 per la Warner Bros Records. Nonostante non fosse stato pubblicato come singolo, il brano riscosse un disc;https://www.youtube.com/v/Kam8t7yoitM?version=3&f=videos&d=AYcmKYILM6rpFUn86Vnl8m4O88HsQjpE1a8d1GxQnGDm&app=youtube_gdata;2000;2004
1319;A Spanish Piece;A Spanish Piece  un brano del gruppo musicale progressive rock britannico Pink Floyd, contenuta nella colonna sonora Soundtrack from the Film More, del film More - Di pi, ancora di pi, del 1969. Caratterizzato da sonorit tipiche spagnole,  un pezzo ;https://www.youtube.com/v/UG411y3_zX0?version=3&f=videos&d=AYcmKYILM6rpFUn86Vnl8m4O88HsQjpE1a8d1GxQnGDm&app=youtube_gdata;1960;1969
1320;2112 (brano musicale);2112  un brano musicale dei Rush, contenuto nell album omonimo del 1976. Si tratta di una suite di oltre venti minuti, divisa in sette parti: I Overture 0:00 II The Temples of Syrinx 4:33 III Discovery 6:45 IV Presentation 10:14 V Oracle: The Dream 13:5;https://www.youtube.com/v/s6aY_jFJGvI?version=3&f=videos&d=AYcmKYILM6rpFUn86Vnl8m4O88HsQjpE1a8d1GxQnGDm&app=youtube_gdata;1970;1976
1321;No Quarter;No Quarter  la settima traccia del quinto album dei Led Zeppelin Houses of the Holy, uscito per l Atlantic Records nel 1973. La canzone  stata composta dal tastierista e bassista John Paul Jones appena prima di partire per Headley Grange per registrare;https://www.youtube.com/v/RKOngTfTMs0?version=3&f=videos&d=AYcmKYILM6rpFUn86Vnl8m4O88HsQjpE1a8d1GxQnGDm&app=youtube_gdata;1970;1973
1322;Tombstone Blues;"Tombstone Blues (lett. ""il blues della pietra tombale"")  una canzone scritta da Bob Dylan e contenuta nel suo acclamato album del  65 intitolato Highway 61 Revisited. Musicalmente si tratta di un brano di blues rock piuttosto canonico, ma con un testo p";https://www.youtube.com/v/j-z-WCGDXlk?version=3&f=videos&d=AYcmKYILM6rpFUn86Vnl8m4O88HsQjpE1a8d1GxQnGDm&app=youtube_gdata;1960;1965
1323;Do the Evolution;Do the Evolution  una canzone dei Pearl Jam, settima traccia del disco del 1998 Yield. Nonostante non sia stata pubblicata come singolo la canzone raggiunse il trentatreesimo posto della Billboard Modern Rock Tracks chart. Nel 1999 la canzone ricevette ;https://www.youtube.com/v/aDaOgu2CQtI?version=3&f=videos&d=AYcmKYILM6rpFUn86Vnl8m4O88HsQjpE1a8d1GxQnGDm&app=youtube_gdata;1990;1998
1324;Wish You Were Here (brano musicale Pink Floyd);Wish You Were Here  il titolo di una canzone dei Pink Floyd, inserita nell omonimo album del 1975. Come la maggior parte delle canzoni dell album,  dedicata ex membro dei Pink Floyd Syd Barrett, allontanato dal gruppo nel 1968 per via di una grave ;https://www.youtube.com/v/S5yDS-oUWRU?version=3&f=videos&d=AYcmKYILM6rpFUn86Vnl8m4O88HsQjpE1a8d1GxQnGDm&app=youtube_gdata;1970;1975
1326;Flower of Scotland;"Flower of Scotland (fiore di Scozia)  uno degli inni nazionali ""non ufficiali"" della Scozia, che ufficialmente non ne ha nessuno. Tra gli altri vengono usati a questo scopo anche Scotland the Brave e Scots Wha Hae. Flower of Scotland commemora la battag";https://www.youtube.com/v/zJ5fLBEpKo8?version=3&f=videos&d=AYcmKYILM6rpFUn86Vnl8m4O88HsQjpE1a8d1GxQnGDm&app=youtube_gdata;1960;1965
1327;Young Lust;Young Lust  una canzone dei Pink Floyd pubblicata nell album The Wall nel 1979. Rappresenta una dei pochi pezzi del disco non scritto esclusivamente da Roger Waters.;https://www.youtube.com/v/wGmIL2gtieU?version=3&f=videos&d=AYcmKYILM6rpFUn86Vnl8m4O88HsQjpE1a8d1GxQnGDm&app=youtube_gdata;1970;1979
1328;Sympathy for the Devil;Sympathy for the Devil  una canzone dei Rolling Stones, traccia iniziale dell album uscito nel 1968 Beggars Banquet. Non  stato tratto nessun singolo dalla  annoverata al  posto nella lista delle 500 migliori canzoni secondo Rolling Stone.;https://www.youtube.com/v/vBecM3CQVD8?version=3&f=videos&d=AYcmKYILM6rpFUn86Vnl8m4O88HsQjpE1a8d1GxQnGDm&app=youtube_gdata;1960;1968
1330;Good Rockin  Tonight;Good Rocking Tonight era in origine una canzone jump blues edita nel 1947 dallo stesso autore, Roy Brown e fu oggetto di cover successive da parte di molti altri artisti. Il brano include il famoso Well I heard the news, there s good rocking;https://www.youtube.com/v/cgdzS4OSQ1M?version=3&f=videos&d=AYcmKYILM6rpFUn86Vnl8m4O88HsQjpE1a8d1GxQnGDm&app=youtube_gdata;1940;1947
1332;Night of Your Life;Night of Your Life  il terzo e ultimo singolo promozionale estratto dal quinto album in studio di David Guetta, Nothing but the  dotato dalla voce dell americana Jennifer Hudson. Il brano  stato pubblicato digitalmente il 22 agosto 2011 come ult;https://www.youtube.com/v/BU2DQANlPmA?version=3&f=videos&d=AYcmKYILM6rpFUn86Vnl8m4O88HsQjpE1a8d1GxQnGDm&app=youtube_gdata;2010;2011
1333;Sweet Leaf;Sweet Leaf  un brano musicale dei Black Sabbath contenuto nel loro album del 1971 Master of Reality. La canzone, un inno celebrativo alla marijuana, deve il suo titolo a un pacchetto di sigarette acquistato a Dublino dal bassista del gruppo Geezer Butle;https://www.youtube.com/v/H3YtvuZ2-I0?version=3&f=videos&d=AYcmKYILM6rpFUn86Vnl8m4O88HsQjpE1a8d1GxQnGDm&app=youtube_gdata;1970;1971
1334;Mother (Pink Floyd);Mother  una canzone dei Pink Floyd contenuta album The Wall, pubblicato nel 1979.;https://www.youtube.com/v/wBkTUzKAiXQ?version=3&f=videos&d=AYcmKYILM6rpFUn86Vnl8m4O88HsQjpE1a8d1GxQnGDm&app=youtube_gdata;1970;1979
1336;Oh! Darling;Oh! Darling  la quarta traccia dell album Abbey Road della rockband inglese The Beatles, pubblicato nel 1969. Il brano, sebbene composto interamente da Paul McCartney,  accreditato alla coppia John Lennon/Paul McCartney.;https://www.youtube.com/v/8PZWGGkrMCk?version=3&f=videos&d=AYcmKYILM6rpFUn86Vnl8m4O88HsQjpE1a8d1GxQnGDm&app=youtube_gdata;1960;1969
1337;Upgrade U;"Upgrade U  un singolo R&B scritto da Beyonc Knowles, Sean Garrett, Solange Knowles, Angela Beyinc, Shawn ""Jay-Z"" Carter, Mk. Makeba, Willie Clarke e Clarence Reid per il secondo album da solista di Beyonc, B Day. Esso  interpretato in duetto col rap";https://www.youtube.com/v/6nr8hPnZfMU?version=3&f=videos&d=AYcmKYILM6rpFUn86Vnl8m4O88HsQjpE1a8d1GxQnGDm&app=youtube_gdata;2000;2006
1338;The Dogs of War;The Dogs of War  un singolo della progressive rock band inglese Pink Floyd, pubblicato nel 1987. Scritto da David Gilmour e Anthony Moore,  tratto dall album A Momentary Lapse of Reason.;https://www.youtube.com/v/qIkW5okTFtg?version=3&f=videos&d=AYcmKYILM6rpFUn86Vnl8m4O88HsQjpE1a8d1GxQnGDm&app=youtube_gdata;1980;1987
1339;Michelle;"Michelle  il titolo di una famosa canzone d amore dei Beatles che compare nell album Rubber Soul del 1965; fu composta principalmente da Paul McCartney e integrata da John Lennon.";https://www.youtube.com/v/BKvee-w0uBc?version=3&f=videos&d=AYcmKYILM6rpFUn86Vnl8m4O88HsQjpE1a8d1GxQnGDm&app=youtube_gdata;1960;1965
1340;The Continuing Story of Bungalow Bill;The Continuing Story of Bungalow Bill  un brano dei Beatles, contenuto nell album The Beatles (meglio conosciuto come White Album o Album Bianco).;https://www.youtube.com/v/5FnmtJd92Qg?version=3&f=videos&d=AYcmKYILM6rpFUn86Vnl8m4O88HsQjpE1a8d1GxQnGDm&app=youtube_gdata;1960;1968
1341;Temporary Like Achilles;Temporary Like Achilles  un brano musicale scritto e registrato da Bob Dylan per il suo album doppio del 1966 intitolato Blonde on Blonde.;https://www.youtube.com/v/g_qhuzXg0Ow?version=3&f=videos&d=AYcmKYILM6rpFUn86Vnl8m4O88HsQjpE1a8d1GxQnGDm&app=youtube_gdata;1960;1966
1342;The Last Few Bricks;The Last Few Bricks  un brano stumentale dei Pink Floyd, eseguito dal vivo solo nel tour di The Wall nel 1980-81 e nel concerto del bassista del gruppo Roger Waters a Berlino nel 1990.;https://www.youtube.com/v/YmrYhLCrJww?version=3&f=videos&d=AYcmKYILM6rpFUn86Vnl8m4O88HsQjpE1a8d1GxQnGDm&app=youtube_gdata;2000;2000
1343;Astronomy Domine;Astronomy Domine  una canzone dei Pink Floyd, la prima traccia del loro album di debutto, The Piper at the Gates of Dawn. Dopo l abbandono di Barrett, la canzone (considerata tra le pi famose della rock band) continu ad essere eseguita dal vivo: la ch;https://www.youtube.com/v/pJh9OLlXenM?version=3&f=videos&d=AYcmKYILM6rpFUn86Vnl8m4O88HsQjpE1a8d1GxQnGDm&app=youtube_gdata;1960;1967
1344;Cross-Eyed Mary;Cross-Eyed Mary  una canzone del gruppo rock britannico dei Jethro Tull, pubblicata come seconda traccia dell album Aqualung del 1971. La canzone narra di una giovane ragazza, Mary, di famiglia povera che per tirare avanti si prostituisce, concedendosi ;https://www.youtube.com/v/K5AamGSuh3k?version=3&f=videos&d=AYcmKYILM6rpFUn86Vnl8m4O88HsQjpE1a8d1GxQnGDm&app=youtube_gdata;1970;1971
1345;Ur So Gay;Ur so Gay  un singolo promozionale di Katy Perry estratto dal secondo album della cantante, One of the Boys.;https://www.youtube.com/v/tWbLkXhGEmo?version=3&f=videos&d=AYcmKYILM6rpFUn86Vnl8m4O88HsQjpE1a8d1GxQnGDm&app=youtube_gdata;2000;2007
1346;Eruption (brano musicale);Eruption  il titolo di una canzone scritta nel 1978 da Eddie Van Halen, chitarrista della band americana Van Halen. Fu pubblicata nel primo album del gruppo: Van Halen, pubblicato per l etichetta discografica Warner Bros. Records. Inizialmente non venne;https://www.youtube.com/v/0qIOCuBwcTc?version=3&f=videos&d=AYcmKYILM6rpFUn86Vnl8m4O88HsQjpE1a8d1GxQnGDm&app=youtube_gdata;1970;1978
1347;Sing, Sing, Sing (With a Swing);Sing, Sing, Sing (With a Swing)  un brano musicale del 1936, scritto da Louis Prima ed originariamente registrato da Prima con la New Orleans Gang che lo pubblic nel 1936 attraverso l etichetta Brunswick Records (con It s Been So Long come lato b). E  ;https://www.youtube.com/v/3mJ4dpNal_k?version=3&f=videos&d=AYcmKYILM6rpFUn86Vnl8m4O88HsQjpE1a8d1GxQnGDm&app=youtube_gdata;1930;1936
1348;The Great Gig in the Sky;"""The Great Gig in the Sky"" (letteralmente ""Il Grande Carro nel Cielo"")  la quinta traccia dell album The Dark Side of the Moon, pubblicato nel 1973 dai Pink Floyd. La canzone  divenuta celebre in tutto il mondo per il lungo assolo vocale che contiene, ";https://www.youtube.com/v/UqCEPytSFqU?version=3&f=videos&d=AYcmKYILM6rpFUn86Vnl8m4O88HsQjpE1a8d1GxQnGDm&app=youtube_gdata;1970;1973
1349;So What (Miles Davis);So What  uno standard composto da Miles Davis e inciso come primo brano del famoso album Kind of Blue, che inaugur la stagione del jazz modale. Ripreso da moltissimi interpreti, spesso con l aggiunta dell assolo di Davis (ad esempio, George Russell ne ;https://www.youtube.com/v/DEC8nqT6Rrk?version=3&f=videos&d=AYcmKYILM6rpFUn86Vnl8m4O88HsQjpE1a8d1GxQnGDm&app=youtube_gdata;1950;1959
1350;Voodoo Chile;"?? Voodoo Chile Artista Jimi Hendrix Autore/i Jimi Hendrix Genere Blues Stile Edito da Reprise Records Tempo Riferimento Esecuzioni notevoli Pubblicazione Incisione Electric Ladyland Data 1968 Data seconda pubblicazione Etichetta Durata 14 59"" Note Campi";https://www.youtube.com/v/OEJh2FFUUoU?version=3&f=videos&d=AYcmKYILM6rpFUn86Vnl8m4O88HsQjpE1a8d1GxQnGDm&app=youtube_gdata;1960;1968
1351;Girl from the North Country;"Girl from the North Country, conosciuta anche come Girl of the North Country,""  una canzone scritta da Bob  stata pubblicata per la prima volta nell album Freewheelin  Bob Dylan, e successivamente in Nashville Skyline, quest ultima versione cant";https://www.youtube.com/v/26oBcgkkbMw?version=3&f=videos&d=AYcmKYILM6rpFUn86Vnl8m4O88HsQjpE1a8d1GxQnGDm&app=youtube_gdata;1960;1963
1352;Mosh (brano musicale);Mosh  il titolo di una canzone di Eminem. Fa parte del suo quinto album in studio, Encore.;PROBLEMA;2000;2004
1353;Instrumedley;L Instrumedley (abbreviazione di Instrumental Medley), chiamato anche The Dance of Instrumentals,  un medley strumentale suonato dalla band progressive metal statunitense dei Dream Theater nei tourne degli album Six Degrees of Inner Turbulence e Train ;https://www.youtube.com/v/tM0Y1Ajqq7g?version=3&f=videos&d=AYcmKYILM6rpFUn86Vnl8m4O88HsQjpE1a8d1GxQnGDm&app=youtube_gdata;2000;2004
1354;When I m Sixty-Four;When I m Sixty-Four  una canzone dei Beatles, scritta da Paul McCartney (ma co-accreditata anche a John Lennon) e pubblicata nel 1967 sull album Sgt. Pepper s Lonely Hearts Club Band.;https://www.youtube.com/v/tGtSpsYURAQ?version=3&f=videos&d=AYcmKYILM6rpFUn86Vnl8m4O88HsQjpE1a8d1GxQnGDm&app=youtube_gdata;1960;1967
1355;I ve Seen All Good People;I ve Seen All Good People  un brano del gruppo musicale inglese di rock progressivo Yes, uscito nel 1971 e contenuto nell album The Yes Album. Scritta principalmente da Jon Anderson,  una delle canzoni pi note della band.;https://www.youtube.com/v/uJM7TdshUbw?version=3&f=videos&d=AYcmKYILM6rpFUn86Vnl8m4O88HsQjpE1a8d1GxQnGDm&app=youtube_gdata;1970;1971
1356;Be Prepared;"Be Prepared (nella versione in italiano Sar re)  un brano composto dall artista britannico Elton John per il classico Disney Il Re Leone; il testo  di Tim Rice.";https://www.youtube.com/v/L0AiN8vrn9Y?version=3&f=videos&d=AYcmKYILM6rpFUn86Vnl8m4O88HsQjpE1a8d1GxQnGDm&app=youtube_gdata;1990;1994
